pmid,abstract,evidence,#Variation,PS3_comments,BS3_comments,functional_experiment,variant_info
30191603,"Hepatocyte nuclear factor 4α (HNF4α) is a master regulator of development and function of digestive tissues. The HNF4A gene uses two separate promoters P1 and P2, with P1 products predominant in adult liver, whereas P2 products prevalent in fetal liver, pancreas, and liver/colon cancer. To date, the mechanisms for the regulation of HNF4A and the dynamic switch of P1-HNF4α and P2-HNF4α during ontogenesis and carcinogenesis are still obscure. Our study validated the previously reported self-stimulation of P1-HNF4α but invalidated the reported synergism between HNF4α and HNF1α. HNF4A-AS1, a long noncoding RNA, is localized between the P2 and P1 promoters of HNF4A. We identified critical roles of P1-HNF4α in regulating the expression of HNF4A-AS1 and its mouse ortholog Hnf4a-os. Paired box 6 (PAX6), a master regulator of pancreas development overexpressed in colon cancer, cooperated with HNF1α to induce P2-HNF4α but antagonized HNF4α in HNF4A-AS1 expression. Thus, PAX6 may be important in determining ontogenic and carcinogenic changes of P2-HNF4α and HNF4A-AS1 in the pancreas and intestine. We also interrogated transactivation activities on multiple gene targets by multiple known and novel HNF4α mutants identified in patients with maturity onset diabetes of the young 1 (MODY1) and liver cancer. Particularly, HNF4α-D78A and HNF4α-G79S, two mutants found in liver cancer with mutations in DNA-binding domain, displayed highly gene-specific transactivation activities. Interestingly, HNF4α-Q277X, a MODY1 truncation mutant, antagonized the transactivation activities of HNF1α and farnesoid X receptor, key regulators of insulin secretion. Taken together, our study provides novel mechanistic insights regarding the transcriptional regulation and transactivation activity of HNF4α in digestive tissues.",PS3_supporting,NM_175914.5:c.787G>C,"Functional studies demonstrated the p.Glu276Gln protein has transactivation below 60% of wildtype, indicating that this variant impacts protein function.",,1,"Gene: HNF4A, chr_pos_ref_alt (hg38): chr20_44419837_G_C, chr_pos_ref_alt (hg37): chr20_43048477_G_C, HGVSg (hg38): g.44419837G>C, HGVSg (hg37): g.43048477G>C, rsID: N/A, HGVSc: c.787G>C, HGVSp (3-letter): p.Glu263Gln, HGVSp (1-letter): p.E263Q"
35615698,"Trabecular meshwork dysfunction is the main cause of primary open angle glaucoma (POAG) associated with elevated intraocular pressure (IOP). Mutant myocilin causes glaucoma mainly via elevating IOP. Previously we have found that accumulated Asn 450 Tyr (N450Y) mutant myocilin impairs human trabecular meshwork (TM) cells by inducing chronic endoplasmic reticulum (ER) stress response in vitro. However, it is unclear how ER stress leads to TM damage and whether N450Y myocilin mutation is associated with POAG in vivo. Here we found that N450Y mutant myocilin induces autophagy, which worsens cell viability, whereas inhibition of autophagy increases viability and decreases cell death in human TM cells. Furthermore, we construct a transgenic mouse model of N450Y myocilin mutation (Tg-MYOCN450Y) and Tg-MYOCN450Y mice exhibiting glaucoma phenotypes: IOP elevation, retinal ganglion cell loss and visual impairment. Consistent with our published in vitro studies, mutant myocilin fails to secrete into aqueous humor, causes ER stress and actives autophagy in Tg-MYOCN450Y mice, and aqueous humor dynamics are altered in Tg-MYOCN450Y mice. In summary, our studies demonstrate that activation of autophagy is correlated with pathogenesis of POAG.",PS3,NM_000261.2:c.1348A>T,"A transgenic mouse model carrying human MYOC Asn450Tyr (PMID: 35615698), displaying non secretion of the Asn450Tyr protein in vivo, exhibited a glaucoma phenotype similar to another pathogenic variant (PMID: 18436825), meeting PS3.",,1,"Gene: MYOC, chr_pos_ref_alt (hg38): chr1_171636092_T_A, chr_pos_ref_alt (hg37): chr1_171605232_T_A, HGVSg (hg38): g.171636092T>A, HGVSg (hg37): g.171605232T>A, rsID: N/A, HGVSc: c.1348A>T, HGVSp (3-letter): p.Asn450Tyr, HGVSp (1-letter): p.N450Y"
18436825,"PURPOSE: To developed a genetic mouse model of primary open-angle glaucoma induced by expression of mutated human myocilin in transgenic mice and to test whether expression of mutated human myocilin in the eye angle structures produces more significant damage to the eye than does mutated mouse myocilin.
METHODS: Recombineering in Escherichia coli was used to introduce the Tyr437His point mutation into a BAC carrying the full-length human MYOCILIN (MYOC) gene and long flanking regions. This BAC was used to produce transgenic mice. The expression of myocilin in the iridocorneal angle tissues and aqueous humor was studied by immunohistochemistry and Western blot analysis. Intraocular pressure was measured noninvasively with a fiber optic transducer. Retinal ganglion cells were retrograde labeled with fluorescent gold, and counted 5 days after labeling.
RESULTS: BAC transgenic mice expressed elevated levels of myocilin in tissues of the iridocorneal angle. Expression of mutated myocilin induced its intracellular accumulation and prevented secretion of both mutated and wild-type myocilin into the aqueous humor. Transgenic mice demonstrated a moderate elevation of intraocular pressure, which was more pronounced at night than in daytime. In the peripheral retina, transgenic mice lost 20% of the retinal ganglion cells and 55% of large retinal ganglion cells. Axonal degeneration was observed at the periphery of the optic nerve.
CONCLUSIONS: Expression of equivalent levels of mutated human or mouse myocilin in the eyes of transgenic mice produce comparable pathologic changes that are similar to those observed in patients with glaucoma.",PS3,NM_000261.2:c.1348A>T,"A transgenic mouse model carrying human MYOC Asn450Tyr (PMID: 35615698), displaying non secretion of the Asn450Tyr protein in vivo, exhibited a glaucoma phenotype similar to another pathogenic variant (PMID: 18436825), meeting PS3.",,1,"Gene: MYOC, chr_pos_ref_alt (hg38): chr1_171636092_T_A, chr_pos_ref_alt (hg37): chr1_171605232_T_A, HGVSg (hg38): g.171636092T>A, HGVSg (hg37): g.171605232T>A, rsID: N/A, HGVSc: c.1348A>T, HGVSp (3-letter): p.Asn450Tyr, HGVSp (1-letter): p.N450Y"
33986768,"Very long-chain acyl-CoA dehydrogenase deficiency (VLCADD) is a rare autosomal recessive disorder of fatty acid metabolism with a variable presentation. The aim of this study was to describe five patients with VLCADD diagnosed through the pilot study and expanded newborn screening (NBS) program that started in 2018 in Slovenia. Four patients were diagnosed through the expanded NBS program with tandem mass spectrometry; one patient was previously diagnosed in a pilot study preceding the NBS implementation. Confirmatory testing consisted of acylcarnitines analysis in dried blood spots, organic acids profiling in urine, genetic analysis of ACADVL gene, and enzyme activity determination in lymphocytes or fibroblasts. Four newborns with specific elevation of acylcarnitines diagnostic for VLCADD and disease-specific acylcarnitines ratios (C14:1, C14, C14:2, C14:1/C2, C14:1/C16) were confirmed with genetic testing: all were compound heterozygotes, two of them had one previously unreported ACDVL gene variant each (NM_000018.3) c.1538C &gt; G; (NP_000009) p.(Ala513Gly) and c.661A &gt; G; p.(Ser221Gly), respectively. In addition, one patient diagnosed in the pilot study also had a specific elevation of acylcarnitines. Subsequent ACDVL genetic analysis confirmed compound heterozygosity. In agreement with the diagnosis, enzyme activity was reduced in five patients tested. In seven other newborns with positive screening results, only single allele variants were found in the ACDVL gene, so the diagnosis was not confirmed. Among these, two variants were novel, c.416T &gt; C and c.1046C &gt; A, respectively (p.Leu139Pro and p.Ala349Glu). In the first 2 years of the expanded NBS program in Slovenia altogether 30,000 newborns were screened. We diagnosed four cases of VLCADD. The estimated VLCADD incidence was 1:7,500 which was much higher than that of the medium-chain acyl-CoA dehydrogenase deficiency (MCADD) cases in the same period. Our study also provided one of the first descriptions of ACADVL variants in Central-Southeastern Europe and reported on 4 novel variants.",PS3_supporting,NM_000018.4:c.1837C>T,"This variant causes significantly reduced enzyme activity determined from lymphocytes, mammalian, and bacterial cell expression systems and results in unstable protein product.",,1,"Gene: ACADVL, chr_pos_ref_alt (hg38): chr17_7224966_C_T, chr_pos_ref_alt (hg37): chr17_7128285_C_T, HGVSg (hg38): g.7224966C>T, HGVSg (hg37): g.7128285C>T, rsID: rs118204014, HGVSc: c.1837C>T, HGVSp (3-letter): p.Arg613Trp, HGVSp (1-letter): p.R613W"
22493702,"Heterozygous glucokinase (GCK) mutations cause a subtype of maturity-onset diabetes of the young (GCK-MODY). Over 600 GCK mutations have been reported of which ∼65% are missense. In many cases co-segregation has not been established and despite the importance of functional studies in ascribing pathogenicity for missense variants these have only been performed for <10% of mutations. The aim of this study was to determine the minimum prevalence of GCK-MODY amongst diabetic subjects in Slovakia by sequencing GCK in 100 Slovakian probands with a phenotype consistent with GCK-MODY and to explore the pathogenicity of identified variants through family and functional studies. Twenty-two mutations were identified in 36 families (17 missense) of which 7 (I110N, V200A, N204D, G258R, F419S, c.580-2A>C, c.1113-1114delGC) were novel. Parental DNA was available for 22 probands (covering 14/22 mutations) and co-segregation established in all cases. Bioinformatic analysis predicted all missense mutations to be damaging. Nine (I110N, V200A, N204D, G223S, G258R, F419S, V244G, L315H, I436N) mutations were functionally evaluated. Basic kinetic analysis explained pathogenicity for 7 mutants which showed reduced glucokinase activity with relative activity indices (RAI) between 0.6 to <0.001 compared to wild-type GCK (1.0). For the remaining 2 mutants additional molecular mechanisms were investigated. Differences in glucokinase regulatory protein (GKRP) -mediated-inhibition of GCK were observed for both L315H & I436N when compared to wild type (IC(50) 14.6±0.1 mM & 20.3±1.6 mM vs.13.3±0.1 mM respectively [p<0.03]). Protein instability as assessed by thermal lability studies demonstrated that both L315H and I436N show marked thermal instability compared to wild-type GCK (RAI at 55°C 8.8±0.8% & 3.1±0.4% vs. 42.5±3.9% respectively [p<0.001]). The minimum prevalence of GCK-MODY amongst Slovakian patients with diabetes was 0.03%. In conclusion, we have identified 22 GCK mutations in 36 Slovakian probands and demonstrate that combining family, bioinformatic and functional studies can aid the interpretation of variants identified by molecular diagnostic screening.",PS3_moderate,NM_001354803.2:c.290T>C,"A kinetic analysis of recombinant wild-type and mutant glucokinase demonstrated the variant p.Phe419Ser has RAI<0.01, less than the MDEP VCEP threshold of 0.50, supporting PS3_Moderate.",,1,"Gene: GCK, chr_pos_ref_alt (hg38): chr7_44145278_A_G, chr_pos_ref_alt (hg37): chr7_44184877_A_G, HGVSg (hg38): g.44145278A>G, HGVSg (hg37): g.44184877A>G, rsID: N/A, HGVSc: c.290T>C, HGVSp (3-letter): p.Phe97Ser, HGVSp (1-letter): p.F97S"
23480858,"BACKGROUND: Very-long-chain acyl-CoA dehydrogenase (VLCAD) deficiency (VLCADD) is diagnosed in the US through newborn screening (NBS). NBS often unequivocally identifies affected individuals, but a growing number of variant patterns can represent mild disease or heterozygous carriers.
AIMS: To evaluate the validity of standard diagnostic procedures for VLCADD by using functional in vitro tools.
METHODS: We retrospectively investigated 13 patient samples referred to our laboratory because of a suspicion of VLCADD but with some uncertainty to the diagnosis. All 13 patients were suspected of having VLCADD either because of abnormal NBS or suggestive clinical findings. ACADVL genomic DNA sequencing data were available for twelve of them. Ten of the patients had an abnormal NBS suggestive of VLCADD, with three samples showing equivocal results. Three exhibited suggestive clinical findings and blood acylcarnitine profile (two of them had a normal NBS and the third one was unscreened). Assay of VLCAD activity and immunoblotting or immunohistologic staining for VLCAD were performed on fibroblasts. Prokaryotic mutagenesis and expression studies were performed for nine uncharacterized ACADVL missense mutations.
RESULTS: VLCAD activity was abnormal in fibroblast cells from 9 patients (8 identified through abnormal NBS, 1 through clinical symptoms). For these 9 patients, immunoblotting/staining showed the variable presence of VLCAD; all but one had two mutated alleles. Two patients with equivocal NBS results (and a heterozygous genotype) and the two patients with normal NBS exhibited normal VLCAD activity and normal VLCAD protein on immunoblotting/staining thus ruling out VLCAD deficiency. Nine pathogenic missense mutations were characterized with prokaryotic expression studies and showed a decrease in enzyme activity and variable stability of VLCAD antigen.
CONCLUSIONS: These results emphasize the importance of functional investigation of abnormal NBS or clinical testing suggestive but not diagnostic of VLCADD. A larger prospective study is necessary to better define the clinical and metabolic ramifications of the defects identified in such patients.",PS3_supporting,NM_000018.4:c.865G>A,This variant causes significantly reduced enzyme activity (15% of WT) determined from a bacterial cell expression system and results in unstable protein product.,,1,"Gene: ACADVL, chr_pos_ref_alt (hg38): chr17_7222289_G_A, chr_pos_ref_alt (hg37): chr17_7125608_G_A, HGVSg (hg38): g.7222289G>A, HGVSg (hg37): g.7125608G>A, rsID: rs200788251, HGVSc: c.865G>A, HGVSp (3-letter): p.Gly289Arg, HGVSp (1-letter): p.G289R"
17186219,"AIMS/HYPOTHESIS: Glucokinase (GCK) acts as a glucose sensor in the pancreatic beta cell and regulates insulin secretion. In the gene encoding GCK the heterozygous mutations that result in enzyme inactivation cause MODY2. Functional studies of naturally occurring GCK mutations associated with hyperglycaemia provide further insight into the biochemical basis of glucose sensor regulation.
MATERIALS AND METHODS: Identification of GCK mutations in selected MODY patients was performed by single-strand conformation polymorphism and direct sequencing. The kinetic parameters and thermal stability of recombinant mutant human GCK were determined, and in pull-down assays the effect of these mutations on the association of GCK with glucokinase (hexokinase 4) regulator (GCKR, also known as glucokinase regulatory protein [GKRP]) and 6-phosphofructo-2-kinase/fructose-2,6-bisphosphatase (PFKFB1, also known as PFK2) was tested.
RESULTS: We identified three novel GCK mutations: the insertion of an asparagine residue at position 161 (inserN161) and two missense mutations (M235V and R308W). We also identified a fourth mutation (R397L) reported in a previous work. Functional characterisation of these mutations revealed that insertion of asparagine residue N161 fully inactivates GCK, whereas the M235V and R308W mutations only partially impair enzymatic activity. In contrast, GCK kinetics was almost unaffected by the R397L mutation. Although none of these mutations affected the interaction of GCK with PFKFB1, we found that the R308W mutation caused protein instability and increased the strength of interaction with GCKR.
CONCLUSIONS/INTERPRETATION: Our results show that different MODY2 mutations impair GCK function through different mechanisms such as enzymatic activity, protein stability and increased interaction with GCKR, helping further elucidate the regulation of GCK activity.",PS3_moderate,NM_000162.5:c.1190G>T,"A kinetic analysis of recombinant wild-type and mutant glucokinase showed that the mutant p.Arg397Leu has RAI=0.72, which is less than the MDEP VCEP threshold of 0.50 (PS3_Moderate; PMID 17186219).",,1,"Gene: GCK, chr_pos_ref_alt (hg38): chr7_44145560_C_A, chr_pos_ref_alt (hg37): chr7_44185159_C_A, HGVSg (hg38): g.44145560C>A, HGVSg (hg37): g.44185159C>A, rsID: rs193929375, HGVSc: c.1190G>T, HGVSp (3-letter): p.Arg397Leu, HGVSp (1-letter): p.R397L"
31510962,"BACKGROUND: Pompe disease is a lysosomal storage disorder caused by the deficiency of acid alpha-glucosidase (EC. 3.2.1.20) due to mutations in human GAA gene. The objective of the present study was to examine clinical and molecular characteristics of infantile-onset Pompe disease (IOPD) in Thailand.
METHODS: Twelve patients with infantile-onset Pompe disease (IOPD) including 10 Thai and two other Asian ethnicities were enrolled. To examine the molecular characteristics of Pompe patients, GAA gene was analyzed by PCR amplification and direct Sanger-sequencing of 20 exons coding region. The novel mutations were transiently transfected in COS-7 cells for functional verification. The severity of the mutation was rated by study of the GAA enzyme activity detected in transfected cells and culture media, as well as the quantity and quality of the proper sized GAA protein demonstrated by western blot analysis. The GAA three dimensional structures were visualized by PyMol software tool.
RESULTS: All patients had hypertrophic cardiomyopathy, generalized muscle weakness, and undetectable or < 1% of GAA normal activity. Three patients received enzyme replacement therapy with variable outcome depending on the age of the start of enzyme replacement therapy (ERT). Seventeen pathogenic mutations including four novel variants: c.876C > G (p.Tyr292X), c.1226insG (p.Asp409GlyfsX95), c.1538G > A (p.Asp513Gly), c.1895 T > G (p.Leu632Arg), and a previously reported rare allele of unknown significance: c.781G > A (p.Ala261Thr) were identified. The rating system ranked p.Tyr292X, p. Asp513Gly and p. Leu632Arg as class ""B"" and p. Ala261Thr as class ""D"" or ""E"". These novel mutations were located in the N-terminal beta-sheet domain and the catalytic domain.
CONCLUSIONS: The present study provides useful information on the mutations of GAA gene in the underrepresented population of Asia which are more diverse than previously described and showing the hotspots in exons 14 and 5, accounting for 62% of mutant alleles. Almost all mutations identified are in class A/B. These data can benefit rapid molecular diagnosis of IOPD and severity rating of the mutations can serve as a partial substitute for cross reactive immunological material (CRIM) study.",PS3_supporting,NM_000152.5:c.1538A>G,"Expression of the variant in COS-7 cells resulted in 0.76% wild type GAA activity in cells and 0% in medium (<5%), and evidence of abnormal GAA synthesis and processing on Western blot, leading the variant to be described as Class B 'potentially less severe', indicating that this variant may impact protein function.",,1,"Gene: GAA, chr_pos_ref_alt (hg38): chr17_80110827_A_G, chr_pos_ref_alt (hg37): chr17_78084626_A_G, HGVSg (hg38): g.80110827A>G, HGVSg (hg37): g.78084626A>G, rsID: rs1598581682, HGVSc: c.1538A>G, HGVSp (3-letter): p.Asp513Gly, HGVSp (1-letter): p.D513G"
25015100,"Mutations in glucokinase (GCK) cause a spectrum of glycemic disorders. Heterozygous loss-of-function mutations cause mild fasting hyperglycemia irrespective of mutation severity due to compensation from the unaffected allele. Conversely, homozygous loss-of-function mutations cause permanent neonatal diabetes requiring lifelong insulin treatment. This study aimed to determine the relationship between in vitro mutation severity and clinical phenotype in a large international case series of patients with homozygous GCK mutations. Clinical characteristics for 30 patients with diabetes due to homozygous GCK mutations (19 unique mutations, including 16 missense) were compiled and assigned a clinical severity grade (CSG) based on birth weight and age at diagnosis. The majority (28 of 30) of subjects were diagnosed before 9 months, with the remaining two at 9 and 15 years. These are the first two cases of a homozygous GCK mutation diagnosed outside infancy. Recombinant mutant GCK proteins were analyzed for kinetic and thermostability characteristics and assigned a relative activity index (RAI) or relative stability index (RSI) value. Six of 16 missense mutations exhibited severe kinetic defects (RAI ≤ 0.01). There was no correlation between CSG and RAI (r(2) = 0.05, P = 0.39), indicating that kinetics alone did not explain the phenotype. Eighty percent of the remaining mutations showed reduced thermostability, the exceptions being the two later-onset mutations which exhibited increased thermostability. Comparison of CSG with RSI detected a highly significant correlation (r(2) = 0.74, P = 0.002). We report the largest case series of homozygous GCK mutations to date and demonstrate that they can cause childhood-onset diabetes, with protein instability being the major determinant of mutation severity.",PS3_Moderate,NM_000162.5:c.622G>A,"A kinetic analysis of recombinant wild-type (WT) and mutant glucokinase demonstrated that the wild-type kinetic parameters passed the quality control, the wild-type ATP Km is between 0.4-0.65, and the p.Ala208Thr has RAI<0.50",,1,"Gene: GCK, chr_pos_ref_alt (hg38): chr7_44149817_C_T, chr_pos_ref_alt (hg37): chr7_44189416_C_T, HGVSg (hg38): g.44149817C>T, HGVSg (hg37): g.44189416C>T, rsID: rs1476637197, HGVSc: c.622G>A, HGVSp (3-letter): p.Ala208Thr, HGVSp (1-letter): p.A208T"
10525657,"AIMS/HYPOTHESIS: Mutations of the glucokinase gene cause hyperglycaemia or hypoglycaemia. A quantitative understanding of these defects of glucose homeostasis linked to the glucokinase gene was lacking. Therefore a database of kinetic variables of wild-type and 20 missense mutants of glucokinase was developed and used in mathematical modelling to predict the thresholds for glucose-stimulated insulin release.
METHODS: Recombinant human glucokinase was generated in E. coli. The k(cat), glucose S(0.5), ATP K(m), and Hill number of glucokinase were determined. Inhibition by Stearoyl CoA and glucokinase regulatory protein and thermal stability were assayed for all mutants kinetically similar to wild-type glucokinase. A mathematical model predicting the threshold for glucose-stimulated insulin release was constructed. This model is based on the two substrate kinetics of glucokinase and the kinetic variables of the database. It is assumed that both glucokinase gene alleles are equally expressed in beta-cells and that induction of glucokinase occurs as a function of basal blood glucose.
RESULTS: Large changes, varying greatly between mutants were found in nearly all variables. Glucokinase flux at threshold for glucose-stimulated insulin release was about 25 % of total phosphorylating potential in the normal beta-cell and this was used to predict thresholds for the mutant heterozygotes. Clinical data for maturity onset diabetes of the young type linked to the glucokinase gene and familial hyperinsulinaemic hypoglycaemia linked to the glucokinase gene and the glucokinase kinetic data of this study were used to test the model. The model predicts fasting blood glucose between 3 and 7 mmol/l in these cases.
CONCLUSION/INTERPRETATION: A kinetics database of wild-type and 20 mutants of glucokinase was developed. Many kinetic differences were found for the mutants. The mathematical model to calculate the threshold for glucose-stimulated insulin release predicts fasting blood glucose between 3 and 7 mmol/l in subjects with glucokinase gene mutations. [Diabetologia 42: 1175-1186]",PS3_supporting,NM_033508.3:c.499A>C,"A kinetic analysis of recombinant wild-type (WT) and mutant glucokinase demonstrated that the wild-type kinetic parameters pass the quality control, but the wild-type ATP Km is not between 0.4-0.65, and the p.Gly175Arg has Kcat/S0.5<0.5 (PS3_Supporting; PMID 10525657).",,1,"Gene: GCK, chr_pos_ref_alt (hg38): chr7_44150046_T_G, chr_pos_ref_alt (hg37): chr7_44189645_T_G, HGVSg (hg38): g.44150046T>G, HGVSg (hg37): g.44189645T>G, rsID: N/A, HGVSc: c.499A>C, HGVSp (3-letter): p.Thr167Pro, HGVSp (1-letter): p.T167P"
