pmid,abstract,evidence,#Variation,PS3_comments,BS3_comments,functional_experiment,variant_info
28594414,"RASopathies comprise a group of disorders clinically characterized by short stature, heart defects, facial dysmorphism, and varying degrees of intellectual disability and cancer predisposition. They are caused by germline variants in genes encoding key components or modulators of the highly conserved RAS-MAPK signalling pathway that lead to dysregulation of cell signal transmission. Germline changes in the genes encoding members of the RAS subfamily of GTPases are rare and associated with variable phenotypes of the RASopathy spectrum, ranging from Costello syndrome (HRAS variants) to Noonan and Cardiofaciocutaneous syndromes (KRAS variants). A small number of RASopathy cases with disease-causing germline NRAS alterations have been reported. Affected individuals exhibited features fitting Noonan syndrome, and the observed germline variants differed from the typical oncogenic NRAS changes occurring as somatic events in tumours. Here we describe 19 new cases with RASopathy due to disease-causing variants in NRAS. Importantly, four of them harbored missense changes affecting Gly12, which was previously described to occur exclusively in cancer. The phenotype in our cohort was variable but well within the RASopathy spectrum. Further, one of the patients (c.35G>A; p.(Gly12Asp)) had a myeloproliferative disorder, and one subject (c.34G>C; p.(Gly12Arg)) exhibited an uncharacterized brain tumour. With this report, we expand the genotype and phenotype spectrum of RASopathy-associated germline NRAS variants and provide evidence that NRAS variants do not spare the cancer-associated mutation hotspots.",PS3_moderate,NM_002524.5:c.173C>T,"ERK (and AKT) activation assays in HEK293T cells promoted enhanced activation of ERK and AKT, even in the absence of stimulation. Additionally, a higher level of NRASThr58Ile in its GTP-bound, active form was observed, indicating that this variant causes gain of function (PMID: 28594414).",,1,"Gene: NRAS, chr_pos_ref_alt (hg38): chr1_114713917_G_A, chr_pos_ref_alt (hg37): chr1_115256538_G_A, HGVSg (hg38): g.114713917G>A, HGVSg (hg37): g.115256538G>A, rsID: rs2101742052, HGVSc: c.173C>T, HGVSp (3-letter): p.Thr58Ile, HGVSp (1-letter): p.T58I"
18621678,"Familial hemiplegic migraine type 3 (FHM3) is a severe autosomal dominant migraine disorder caused by mutations in the voltage-gated sodium channel Na(V)1.1 encoded by SCN1A. We determined the functional consequences of three mutations linked to FHM3 (L263V, Q1489K, and L1649Q) in an effort to identify molecular defects that underlie this inherited migraine disorder. Only L263V and Q1489K generated quantifiable sodium currents when coexpressed in tsA201 cells with the human beta(1) and beta(2) accessory subunits. The third mutant, L1649Q, failed to generate measurable whole-cell current because of markedly reduced cell surface expression. Compared to WT-Na(V)1.1, Q1489K exhibited increased persistent current but also enhanced entry into slow inactivation as well as delayed recovery from fast and slow inactivation, thus resulting in a predominantly loss-of-function phenotype further demonstrated by a greater loss of channel availability during repetitive stimulation. In contrast, L263V exhibited gain-of-function features, including delayed entry into, as well as accelerated recovery from, fast inactivation; depolarizing shifts in the steady-state voltage dependence of fast and slow inactivation; increased persistent current; and delayed entry into slow inactivation. Notably, the two mutations (Q1489K and L1649Q) that exhibited partial or complete loss of function are linked to typical FHM, whereas the gain-of-function mutation L263V occurred in a family having both FHM and a high incidence of generalized epilepsy. We infer from these data that a complex spectrum of Na(V)1.1 defects can cause FHM3. Our results also emphasize the complex relationship between migraine and epilepsy and provide further evidence that both disorders may share common molecular mechanisms.",PS3,NM_001165963.4:c.4465C>A,"Whole-cell voltage-clamp studies on human tsA201 cells showed increased persistent current, enhanced entry into slow activation, and delayed recovery from fast and slow inactivation indicating that this variant impacts protein function.",,1,"Gene: SCN1A, chr_pos_ref_alt (hg38): chr2_165998049_G_T, chr_pos_ref_alt (hg37): chr2_166854559_G_T, HGVSg (hg38): g.165998049G>T, HGVSg (hg37): g.166854559G>T, rsID: rs121918628, HGVSc: c.4465C>A, HGVSp (3-letter): p.Gln1489Lys, HGVSp (1-letter): p.Q1489K"
18632931,"Familial hemiplegic migraine (FHM) is an autosomal dominant inherited subtype of severe migraine with aura. Mutations causing FHM (type 3) have been identified in SCN1A, the gene encoding neuronal voltage-gated Na(v)1.1 Na(+) channel alpha subunit, but functional studies have been done using the cardiac Na(v)1.5 isoform, and the observed effects were similar to those of some epileptogenic mutations. We studied the FHM mutation Q1489K by transfecting tsA-201 cells and cultured neurons with human Na(v)1.1. We show that the mutation has effects on the gating properties of the channel that can be consistent with both hyperexcitability and hypoexcitability. Simulation of neuronal firing and long depolarizing pulses mimicking promigraine conditions revealed that the effect of the mutation is a gain of function consistent with increased neuronal firing. However, during high-frequency discharges and long depolarizations, the effect became a loss of function. Recordings of firing of transfected neurons showed higher firing frequency at the beginning of long discharges. This self-limited capacity to induce neuronal hyperexcitability may be a specific characteristic of migraine mutations, able to both trigger the cascade of events that leads to migraine and counteract the development of extreme hyperexcitability typical of epileptic seizures. Thus, we found a possible difference in the functional effects of FHM and familial epilepsy mutations of Nav1.1.",PS3,NM_001165963.4:c.4465C>A,"Whole-cell voltage-clamp studies on human tsA201 cells showed increased persistent current, enhanced entry into slow activation, and delayed recovery from fast and slow inactivation indicating that this variant impacts protein function.",,1,"Gene: SCN1A, chr_pos_ref_alt (hg38): chr2_165998049_G_T, chr_pos_ref_alt (hg37): chr2_166854559_G_T, HGVSg (hg38): g.165998049G>T, HGVSg (hg37): g.166854559G>T, rsID: rs121918628, HGVSc: c.4465C>A, HGVSp (3-letter): p.Gln1489Lys, HGVSp (1-letter): p.Q1489K"
22479377,"von Willebrand factor (VWF) is essential for normal hemostasis. VWF gene mutations cause the hemorrhagic von Willebrand disease (VWD). In this study, a 9-year-old boy was diagnosed as type 2A VWD, based on a history of abnormal bleeding, low plasma VWF antigen and activity, low plasma factor VIII activity, and lack of plasma high-molecular-weight (HMW) VWF multimers. Sequencing analysis detected a 6-bp deletion in exon 28 of his VWF gene, which created a mutant lacking D1529V1530 residues in VWF A2 domain. This mutation also existed in his family members with abnormal bleedings but not in >60 normal controls. In transfected HEK293 cells, recombinant VWF ΔD1529V1530 protein had markedly reduced levels in the conditioned medium (42±4% of wild-type (WT) VWF, p<0.01). The mutant VWF in the medium had less HMW multimers. In contrast, the intracellular levels of the mutant VWF in the transfected cells were significantly higher than that of WT (174±29%, p<0.05), indicating intracellular retention of the mutant VWF. In co-transfection experiments, the mutant reduced WT VWF secretion from the cells. By immunofluorescence staining, the retention of the mutant VWF was identified within the endoplasmic reticulum (ER). Together, we identified a unique VWF mutation responsible for the bleeding phenotype in a patient family with type 2A VWD. The mutation impaired VWF trafficking through the ER, thereby preventing VWF secretion from the cells. Our results illustrate the diversity of VWF gene mutations, which contributes to the wide spectrum of VWD.",PS3,NM_000552.5:c.4586_4591del,"Multimerization assay performed with the Asp1529_Val1530del recombinant mutant vWF expressed by HEK293 showed abnormal multimers with less HMW multimers, indicating that this variant has a damaging effect on protein function.",,1,"Gene: VWF, chr_pos_ref_alt (hg38): chr12_6018826_CCCACAT_C, chr_pos_ref_alt (hg37): chr12_6127992_CCCACAT_C, HGVSg (hg38): g.6018830_6018835del, HGVSg (hg37): g.6127996_6128001del, rsID: N/A, HGVSc: c.4586_4591del, HGVSp (3-letter): N/A, HGVSp (1-letter): N/A"
31291970,"BACKGROUND: Monogenic diabetes (MgD) accounts for 1-2% of all diabetes cases. In adults, MgD is difficult to distinguish from common diabetes causes. We assessed the diagnosis rate and genetic spectrum of MgD using next-generation sequencing in patients with late adolescence/adult-onset diabetes referred for a clinical suspicion of MgD.
METHODS: This cross-sectional study was performed in 1564 probands recruited in 116 Endocrinology departments. Inclusion criteria were the absence of diabetes autoantibodies, and at least two of the three following criteria: an age ≤ 40 years and a body mass index (BMI) &lt; 30 kg/m2 at diagnosis in the proband or in at least two relatives with diabetes, and a family history of diabetes in ≥ 2 generations. Seven genes (GCK, HNF1A, HNF4A, HNF1B, ABCC8, KCNJ11, and INS) were analyzed. Variant pathogenicity was assessed using current guidelines.
RESULTS: Pathogenic variants were identified in 254 patients (16.2%) and in 23.2% of EuroCaucasian patients. Using more stringent selection criteria (family history of diabetes in ≥ 3 generations, age at diabetes ≤ 40 years and BMI &lt; 30 kg/m2 in the proband, EuroCaucasian origin) increased the diagnosis rate to 43%, but with 70% of the identified cases being missed. GCK (44%), HNF1A (33%), and HNF4A (10%) accounted for the majority of the cases. HNF1B (6%), ABCC8/KCNJ11 (4.4%), and INS (2.8%) variants accounted for 13% of the cases. As compared to non-monogenic cases, a younger age, a lower BMI and the absence of diabetes symptoms at diagnosis, a EuroCaucasian origin, and a family history of diabetes in ≥ 3 generations were associated with MgD, but with wide phenotype overlaps between the two groups. In the total population, two clusters were identified, that mainly differed by the severity of diabetes at onset. MgDs were more prevalent in the milder phenotypic cluster. The phenotypes of the 59 patients (3.8%) with variants of uncertain significance were different from that of patients with pathogenic variants, but not from that of non-monogenic patients.
CONCLUSION: Variants of HNF1B and the K-ATP channel genes were more frequently involved in MgD than previously reported. Phenotype overlapping makes the diagnosis of MgD difficult in adolescents/adults and underlies the benefit of NGS in clinically selected patients.",PS3,NM_175914.5:c.1063G>C,"There is evidence from RNA and in silico studies that this non-canonical splicing variant results in aberrant splicing, indicating that this variant impacts protein function (ClinVar submission from Dept of Medical Genetics, AP-HP Sorbonne University, Pitié-Salpêtrière hospital - Accession: SCV004037073.1).",,1,"Gene: HNF4A, chr_pos_ref_alt (hg38): chr20_44424254_G_C, chr_pos_ref_alt (hg37): chr20_43052894_G_C, HGVSg (hg38): g.44424254G>C, HGVSg (hg37): g.43052894G>C, rsID: N/A, HGVSc: c.1063G>C, HGVSp (3-letter): p.Gly355Arg, HGVSp (1-letter): p.G355R"
33198351,"The lysosomal storage disorder, mucopolysaccharidosis I (MPSI), results from mutations in IDUA, the gene that encodes the glycosaminoglycan-degrading enzyme α-L-iduronidase. Newborn screening efforts for MPSI have greatly increased the number of novel IDUA variants identified, but with insufficient experimental evidence regarding their pathogenicity, many of these variants remain classified as variants of uncertain significance (VUS). Defining pathogenicity for novel IDUA variants is critical for decisions regarding medical management and early intervention. Here, we describe a biochemical platform for the characterization of IDUA variants that relies on viral delivery of IDUA DNA into IDUA-deficient HAP1 cells and isolation of single cell expression clones. The relative specific activity of wild-type and variant α-iduronidase was determined using a combination of Western blot analysis and α-iduronidase activity assays. The specific activity of each variant enzyme was consistent across different single cell clones despite variable IDUA expression and could be accurately determined down to 0.05-0.01% of WT α-iduronidase activity. With this strategy we compared the specific activities of known pseudodeficiency variants (p.His82Gln, p.Ala79Thr, p.Val322Glu, p.Asp223Asn) or pathogenic variants (p.Ser633Leu, p.His240Arg) with variants of uncertain significance (p.Ser586Phe, p.Ile272Leu). The p.Ser633Leu and p.His240Arg variants both show very low activities consistent with their association with Scheie syndrome. In our experiments, however, p.His240Arg exhibited a specific activity five times higher than p.Ser633Leu in contrast to other reports showing equivalent activity. Cell clones expressing the p.Ser586Phe and p.Ile272Leu variants had specific activities in the range of other pseudodeficiency variants tested. Our findings show that pseudodeficiency and pathogenic variants can be distinguished from each other with regard to specific activity, and confirms that all the pseudodeficiency variants variably reduce α-iduronidase activity. We envision this platform will be a valuable resource for the rigorous assessment of the novel IDUA variants emerging from the expansion of newborn screening efforts.",PS3_supporting,NM_000203.5:c.544G>A,"When expressed in CHO cells and HAP1 cells, the variant resulted in no IDUA activity across multiple studies.",,1,"Gene: IDUA, chr_pos_ref_alt (hg38): chr4_1001518_G_A, chr_pos_ref_alt (hg37): chr4_995306_G_A, HGVSg (hg38): g.1001518G>A, HGVSg (hg37): g.995306G>A, rsID: rs754154200, HGVSc: c.544G>A, HGVSp (3-letter): p.Glu182Lys, HGVSp (1-letter): p.E182K"
25185554,"The primary hemostatic von Willebrand factor (vWF) functions to sequester platelets from rheological blood flow and mediates their adhesion to damaged subendothelium at sites of vascular injury. We have surveyed the effect of 16 disease-causing mutations identified in patients diagnosed with the bleeding diathesis disorder, von Willebrand disease (vWD), on the structure and rheology of vWF A1 domain adhesiveness to the platelet GPIbα receptor. These mutations have a dynamic phenotypical range of bleeding from lack of platelet adhesion to severe thrombocytopenia. Using new rheological tools in combination with classical thermodynamic, biophysical, and spectroscopic metrics, we establish a high propensity of the A1 domain to misfold to pathological molten globule conformations that differentially alter the strength of platelet adhesion under shear flow. Rheodynamic analysis establishes a quantitative rank order between shear-rate-dependent platelet-translocation pause times that linearly correlate with clinically reported measures of patient platelet counts and the severity of thrombocytopenia. These results suggest that specific secondary structure elements remaining in these pathological conformations of the A1 domain regulate GPIbα binding and the strength of vWF-platelet interactions, which affects the vWD functional phenotype and the severity of thrombocytopenia.",PS3,NM_000552.5:c.3854C>T,The A1 domain from this variant exhibited complete loss of shear-flow-dependent platelet adhesion (PMID: 25185554).,,1,"Gene: VWF, chr_pos_ref_alt (hg38): chr12_6019564_G_A, chr_pos_ref_alt (hg37): chr12_6128730_G_A, HGVSg (hg38): g.6019564G>A, HGVSg (hg37): g.6128730G>A, rsID: rs61749380, HGVSc: c.3854C>T, HGVSp (3-letter): p.Ser1285Phe, HGVSp (1-letter): p.S1285F"
27214402,"In human mitochondria, the AUA codon encodes methionine via a mitochondrial transfer RNA for methionine (mt-tRNA(Met)) that contains 5-formylcytidine (f(5)C) at the first position of the anticodon (position 34). f(5)C34 is required for deciphering the AUA codon during protein synthesis. Until now, the biogenesis and physiological role of f(5)C34 were unknown. We demonstrate that biogenesis of f(5)C34 is initiated by S-adenosylmethionine (AdoMet)-dependent methylation catalyzed by NSUN3, a putative methyltransferase in mitochondria. NSUN3-knockout cells showed strong reduction in mitochondrial protein synthesis and reduced oxygen consumption, leading to deficient mitochondrial activity. We reconstituted formation of 5-methylcytidine (m(5)C) at position 34 (m(5)C34) on mt-tRNA(Met) with recombinant NSUN3 in the presence of AdoMet, demonstrating that NSUN3-mediated m(5)C34 formation initiates f(5)C34 biogenesis. We also found two disease-associated point mutations in mt-tRNA(Met) that impaired m(5)C34 formation by NSUN3, indicating that a lack of f(5)C34 has pathological consequences.",PS3_supporting,NC_012920.1:m.4437C>T,A study showed impaired methylation critical for the recognition of the MT-TM codon during protein synthesis,,1,"Gene: , chr_pos_ref_alt (hg38): chrM_4437_C_T, chr_pos_ref_alt (hg37): chrM_4438_C_T, HGVSg (hg38): g.N/A, HGVSg (hg37): g.N/A, rsID: N/A, HGVSc: N/A, HGVSp (3-letter): N/A, HGVSp (1-letter): N/A"
23613869,"Nemaline myopathy (NM) is the most common disease entity among non-dystrophic skeletal muscle congenital diseases. Mutations in the skeletal muscle α-actin gene (ACTA1) account for ∼25% of all NM cases and are the most frequent cause of severe forms of NM. So far, the mechanisms underlying muscle weakness in NM patients remain unclear. Additionally, recent Magnetic Resonance Imaging (MRI) studies reported a progressive fatty infiltration of skeletal muscle with a specific muscle involvement in patients with ACTA1 mutations. We investigated strictly noninvasively the gastrocnemius muscle function of a mouse model carrying a mutation in the ACTA1 gene (H40Y). Skeletal muscle anatomy (hindlimb muscles and fat volumes) and energy metabolism were studied using MRI and (31)Phosphorus magnetic resonance spectroscopy. Skeletal muscle contractile performance was investigated while applying a force-frequency protocol (from 1-150 Hz) and a fatigue protocol (80 stimuli at 40 Hz). H40Y mice showed a reduction of both absolute (-40%) and specific (-25%) maximal force production as compared to controls. Interestingly, muscle weakness was associated with an improved resistance to fatigue (+40%) and an increased energy cost. On the contrary, the force frequency relationship was not modified in H40Y mice and the extent of fatty infiltration was minor and not different from the WT group. We concluded that the H40Y mouse model does not reproduce human MRI findings but shows a severe muscle weakness which might be related to an alteration of intrinsic muscular properties. The increased energy cost in H40Y mice might be related to either an impaired mitochondrial function or an alteration at the cross-bridges level. Overall, we provided a unique set of anatomic, metabolic and functional biomarkers that might be relevant for monitoring the progression of NM disease but also for assessing the efficacy of potential therapeutic interventions at a preclinical level.",PS3,NM_001100.4:c.124C>T,In vivo studies in a mouse model demonstrated impaired function of ACTA1 and limited intrinsic force-generating capacity and maximal tetanic force.,,1,"Gene: ACTA1, chr_pos_ref_alt (hg38): chr1_229432992_G_A, chr_pos_ref_alt (hg37): chr1_229568739_G_A, HGVSg (hg38): g.229432992G>A, HGVSg (hg37): g.229568739G>A, rsID: rs2102736554, HGVSc: c.124C>T, HGVSp (3-letter): p.His42Tyr, HGVSp (1-letter): p.H42Y"
32695144,"Background: Pathogenic variants in the low density lipoprotein receptor gene are associated with familial hypercholesterolemia. Some of these variants can result in incorrect folding of the LDLR protein, which is then accumulated inside the cell and cannot fulfill its function to internalize LDL particles. We analyzed the functional impact of 10 LDLR variants localized in the beta-propeller of epidermal growth factor precursor homology domain. The experimental part of the work was complemented by a structural analysis on the basis of 3D LDLR protein structure. Methods: T-Rex Chinese hamster ovary cells transfected with the human LDLR gene were used for live cell imaging microscopy, flow cytometry, and qRT-PCR analysis. Results: Our results showed that the analyzed LDLR protein variants can be divided into three groups. (1) The variants buried inside the 3D protein structure expressing proteins accumulated in the endoplasmic reticulum (ER) with no or reduced plasma membrane localization and LDL particle internalization, and associated with an increased gene expression of ER-resident chaperones. (2) The variants localized on the surface of 3D protein structure with slightly reduced LDLR plasma membrane localization and LDL particle internalization, and associated with no increased mRNA level of ER-resident chaperones. (3) The variants localized on the surface of the 3D protein structure but expressing proteins with cell responses similar to the group 1. Conclusion: All analyzed LDLR variants have been evaluated as pathogenic but with different effects on protein localization and function, and expression of genes associated with ER stress.",PS3,NM_000527.5:c.1747C>T,"Functional studies reported in PMID 32695144 (Dušková et al., 2020) performed using heterologous cells (CHO), WB and FACS - results - 52% expression and 44% internalization. The variant showed a deleterious effect on the protein localization and function, and was associated with the accumulation of the protein in the ER. Results are below 70%, so PS3 is met. Functional studies reported in PMID 21511053 (Zhao et al., 2011) performed using retrovirus transfected LDLR-/- fibroblasts, FACS and 125I-LDL assays - results - approximately 50% cell surface LDLR, 50-60% LDL-LDLR uptake and normal LDL-LDLR binding. Results are below 70%, so PS3 is met. Overall, both functional studies are consistent with damaging effect.",,1,"Gene: LDLR, chr_pos_ref_alt (hg38): chr19_11116900_C_T, chr_pos_ref_alt (hg37): chr19_11227576_C_T, HGVSg (hg38): g.11116900C>T, HGVSg (hg37): g.11227576C>T, rsID: rs730882109, HGVSc: c.1747C>T, HGVSp (3-letter): p.His583Tyr, HGVSp (1-letter): p.H583Y"
21511053,"The LDL receptor (LDLR) is an endocytic receptor that plays a major role in the clearance of atherogenic lipoproteins from the circulation. During the endocytic process, the LDLR first binds lipoprotein at the cell surface and then traffics to endosomes, where the receptor releases bound lipoprotein. Release is acid-dependent and correlates with the formation of an intramolecular contact within the receptor. Human mutations at residues that form the contact are associated with familial hypercholesterolemia (FH) and the goal of the present study was to determine the role of contact residues on LDLR function. We show that mutations at nine contact residues reduce the ability of the LDLR to support lipoprotein uptake. Unexpectedly, only four of the mutations (W515A, W541A, H562Y and H586Y) impaired acid-dependent lipoprotein release. The remaining mutations decreased the lipoprotein-binding capacity of the LDLR through either reduction in the number of surface receptors (H190Y, K560W, H562Y and K582W) or reduction in the fraction of surface receptors that were competent to bind lipoprotein (W144A and W193A). We also examined three residues, distal to the contact, which were predicted to be necessary for the LDLR to adopt the acidic conformation. Of the three mutations we tested (G293S, F362A and G375S), one mutation (F362A) reduced lipoprotein uptake. Together, these data suggest that the intramolecular interface plays multiple roles in LDLR function.",PS3,NM_000527.5:c.1747C>T,"Functional studies reported in PMID 32695144 (Dušková et al., 2020) performed using heterologous cells (CHO), WB and FACS - results - 52% expression and 44% internalization. The variant showed a deleterious effect on the protein localization and function, and was associated with the accumulation of the protein in the ER. Results are below 70%, so PS3 is met. Functional studies reported in PMID 21511053 (Zhao et al., 2011) performed using retrovirus transfected LDLR-/- fibroblasts, FACS and 125I-LDL assays - results - approximately 50% cell surface LDLR, 50-60% LDL-LDLR uptake and normal LDL-LDLR binding. Results are below 70%, so PS3 is met. Overall, both functional studies are consistent with damaging effect.",,1,"Gene: LDLR, chr_pos_ref_alt (hg38): chr19_11116900_C_T, chr_pos_ref_alt (hg37): chr19_11227576_C_T, HGVSg (hg38): g.11116900C>T, HGVSg (hg37): g.11227576C>T, rsID: rs730882109, HGVSc: c.1747C>T, HGVSp (3-letter): p.His583Tyr, HGVSp (1-letter): p.H583Y"
