pmid,abstract,evidence,#Variation,PS3_comments,BS3_comments,functional_experiment,variant_info
27857962,"Malignant hyperthermia manifests as a rapid and sustained rise in temperature in response to pharmacological triggering agents, e.g. inhalational anesthetics and the muscle relaxant suxamethonium. Other clinical signs include an increase in end-tidal CO<sub>2</sub>, increased O<sub>2</sub> consumption, as well as tachycardia, and if untreated a malignant hyperthermia episode can result in death. The metabolic changes are caused by dysregulation of skeletal muscle Ca2+ homeostasis, resulting from a defective ryanodine receptor Ca2+ channel, which resides in the sarcoplasmic reticulum and controls the flux of Ca2+ ions from intracellular stores to the cytoplasm. Most genetic variants associated with susceptibility to malignant hyperthermia occur in the RYR1 gene encoding the ryanodine receptor type 1. While malignant hyperthermia susceptibility can be diagnosed by in vitro contracture testing of skeletal muscle biopsy tissue, it is advantageous to use DNA testing. Currently only 35 of over 400 potential variants in RYR1 have been classed as functionally causative of malignant hyperthermia and thus can be used for DNA diagnostic tests. Here we describe functional analysis of 2 RYR1 variants (c. 7042_7044delCAG, p.ΔGlu2348 and c.641C&gt;T, p.Thr214Met) that occur in the same malignant hyperthermia susceptible family. The p.Glu2348 deletion, causes hypersensitivity to ryanodine receptor agonists using in vitro analysis of cloned human RYR1 cDNA expressed in HEK293T cells, while the Thr214Met substitution, does not appear to significantly alter sensitivity to agonist in the same system. We suggest that the c. 7042_7044delCAG, p.ΔGlu2348 RYR1 variant could be added to the list of diagnostic mutations for susceptibility to malignant hyperthermia.",BS3_supporting,NM_000540.2:c.641C>T,Functional studies in HEK293 cells do not show a significant increase in sensitivity to RYR1 agonists.,Functional studies in HEK293 cells do not show a significant increase in sensitivity to RYR1 agonists.,1,"Gene: RYR1, chr_pos_ref_alt (hg38): chr19_38446481_C_T, chr_pos_ref_alt (hg37): chr19_38937121_C_T, HGVSg (hg38): g.38446481C>T, HGVSg (hg37): g.38937121C>T, rsID: rs727504129, HGVSc: c.641C>T, HGVSp (3-letter): p.Thr214Met, HGVSp (1-letter): p.T214M"
36208971,"BACKGROUND: A major bottleneck to the introduction of noninvasive presymptomatic diagnostic tests for the pharmacogenetic disorder malignant hyperthermia is the lack of functional data for associated variants.
METHODS: We screened 50 genes having a potential role in skeletal muscle calcium homeostasis using the HaloPlex™ (Agilent Technologies, Santa Clara, CA, USA) target enrichment system and next-generation sequencing. Twenty-one patients with a history of a clinical malignant hyperthermia reaction together with a positive in vitro contracture test were included. Eight variants in RYR1 were subsequently introduced into the cDNA for the human ryanodine receptor gene and tested in cultured human embryonic kidney (HEK293) cells for their effect on calcium release from intracellular stores in response to the ryanodine receptor-1 agonist 4-chloro-m-cresol using fura-2 as calcium indicator. Each variant was subjected to in silico curation using the European Malignant Hyperthermia Group scoring matrix and ClinGen RYR1 variant curation expert panel guidelines.
RESULTS: Potentially causative RYR1 variants were identified in 15 patients. Of these, two families carried two RYR1 variants, five variants had been previously reported as 'pathogenic', two variants had been previously reported as 'likely benign', and eight were of 'uncertain significance'. Of these eight variants, four showed hypersensitivity to 4-chloro-m-cresol. Three variants were reclassified as either 'pathogenic' or 'likely pathogenic'. Two were classified as 'benign', whilst three remained of 'uncertain significance'.
CONCLUSIONS: Three (p.Tyr1711Cys, p.Val2280Ile, and p.Arg4737Gln) additional variants can be added to the list of RYR1 disease-associated variants managed by the European Malignant Hyperthermia Group. These can therefore be used diagnostically in the future. Three variants (p.Glu2348Gly, p.Asn2634Lys, and p.Arg3629Trp) that remained classified as of uncertain significance require further family studies or a different functional test to determine clinical relevance in malignant hyperthermia.",PS3_moderate,NM_000540.2:c.6838G>A,Functional studies in HEK293 cells show an increased sensitivity to RYR1 agonists,,1,"Gene: RYR1, chr_pos_ref_alt (hg38): chr19_38496901_G_A, chr_pos_ref_alt (hg37): chr19_38987541_G_A, HGVSg (hg38): g.38496901G>A, HGVSg (hg37): g.38987541G>A, rsID: rs193922797, HGVSc: c.6838G>A, HGVSp (3-letter): p.Val2280Ile, HGVSp (1-letter): p.V2280I"
33490280,"BACKGROUND: We investigated the potential safety of remimazolam and propofol in malignant hyperthermia- (HM-) susceptible patients using ryanodine receptor 1- (RYR1-) expressing human embryonic kidney- (HEK-) 293 cells.
METHODS: We compared the enhanced responsiveness of HEK-293 cells expressing wild-type RYR1 with that of mutant RYR1 to caffeine following perfusion with remimazolam or propofol. Furthermore, we investigated whether RYR1 enhanced the responsiveness of cells to remimazolam or propofol and compared the median effective concentration (EC<sub>50</sub>; i.e., the concentration required to reach half-maximal activation) using an unpaired two-tailed t-test while a P &lt; 0.05 was considered significant.
RESULTS: Remimazolam and propofol did not promote the caffeine-induced increase in intracellular Ca2+ levels in HEK-293 cells expressing mutant RYR1 even with exposure to approximately 100-fold the clinically used concentration. In wild-type RYR1, EC<sub>50</sub> values of remimazolam following refusion vs. nonperfusion were 2.86 mM vs. 2.75 mM (P = 0.76) while for propofol perfusion vs. nonperfusion, they were 2.76 mM vs. 2.75 mM, respectively (P = 0.83). In mutant RYR1, EC<sub>50</sub> values of remimazolam refusion vs. nonperfusion were 1.58 mM vs. 1.71 mM, respectively (P = 0.63) while for propofol perfusion vs. nonperfusion, they were 1.65 mM vs. 1.71 mM, respectively (P = 0.73). Remimazolam and propofol increased intracellular Ca2+ levels in a concentration-dependent manner, but the effect was not enhanced by RYR1. EC<sub>50</sub> values of remimazolam with non-RYR1 vs. wild-type RYR1 were 1.00 mM vs. 0.92 mM, respectively (P = 0.91) while those of propofol were 1.09 mM vs. 1.05 mM, respectively (P = 0.84).
CONCLUSIONS: The increase in intracellular Ca2+ concentration caused by remimazolam or propofol was not considered an RYR1-mediated reaction. We conclude that remimazolam and propofol can be safely used as an anesthetic in MH-susceptible patients with RYR1-mutation without causing MH and may be safely substituted for an MH-triggering anesthetic when RYR1-mediated MH occurs.",PS3_moderate,NM_001042723.2:c.7035C>A,Functional studies in HEK293 cells show an increased sensitivity to RYR1 agonists.,,1,"Gene: RYR1, chr_pos_ref_alt (hg38): chr19_38499642_C_A, chr_pos_ref_alt (hg37): chr19_38990282_C_A, HGVSg (hg38): g.38499642C>A, HGVSg (hg37): g.38990282C>A, rsID: rs1448949048, HGVSc: c.7035C>A, HGVSp (3-letter): p.Ser2345Arg, HGVSp (1-letter): p.S2345R"
8094613,"Glycogen-storage disease type II (GSDII) is caused by the deficiency of lysosomal alpha-glucosidase (acid maltase). This paper reports on the analysis of the mutant alleles in an American black patient with an adult form of GSDII (GM1935). The lysosomal alpha-glucosidase precursor of this patient has abnormal molecular features: (i) the molecular mass is decreased, (ii) the phosphorylation is deficient and (iii) the proteolytic processing is impaired. Sequence analysis revealed four mutations leading to amino acid alterations: Asp-645-->Glu, Val-816-->Ile, Arg-854-->Stop and Thr-927-->Ile. By using allele-specific oligonucleotide hybridization on PCR-amplified cDNA we have demonstrated that the Arg-854-->Stop mutation is located in one allele that is not expressed, and that the other allele contains the remaining three mutations. Each of the mutations was introduced in wild-type cDNA and expressed in COS cells to analyse the effect on biosynthesis, transport and phosphorylation of lysosomal alpha-glucosidase. The Val-816-->Ile substitution appeared to have no significant effect in contrast with results [Martiniuk, Mehler, Bodkin, Tzall, Hirshhorn, Zhong and Hirschhorn (1991) DNA Cell Biol. 10, 681-687] and was therefore defined as a polymorphism. The Thr-927-->Ile substitution deleting one of the seven glycosylation sites was found to be responsible for the decrease in molecular-mass, but not for the deficient proteolytic processing and phosphorylation. It did not cause the enzyme deficiency either. The third mutation leading to the Asp-645-->Glu substitution was proven to account in full for the observed defects in transport, phosphorylation and proteolytic processing of the newly synthesized alpha-glucosidase precursor of the patient.",PS3_moderate,NM_000152.5:c.1935C>A,"Measurement of GAA activity in COS cells transfected with the variant showed <10% normal GAA activity indicating that this variant impacts protein function (PMID: 8094613, 19862843). In addition, little to no mature 76 kDa protein was detected by pulse-chase analysis, suggesting abnormal synthesis and/or processing of the protein (PMID: 8094613).",,1,"Gene: GAA, chr_pos_ref_alt (hg38): chr17_80112922_C_A, chr_pos_ref_alt (hg37): chr17_78086721_C_A, HGVSg (hg38): g.80112922C>A, HGVSg (hg37): g.78086721C>A, rsID: rs28940868, HGVSc: c.1935C>A, HGVSp (3-letter): p.Asp645Glu, HGVSp (1-letter): p.D645E"
8078883,"A point mutation in the mtDNA-encoded ATP6 gene (T-->G at nt 8993) associated with Leigh syndrome in two pedigrees was found to decrease ADP-stimulated (state III) respiration and the ratio of ADP molecules phosphorylated to oxygen atoms reduced (ADP/O ratio) but did not affect 2,4-dinitrophenol (DNP)-uncoupled respiration, suggesting a defective mitochondrial H(+)-translocating ATP synthase. Intact mitochondria isolated from patient and control lymphoblastoid cell lines were tested for state III, ADP-limited (state IV), and DNP-uncoupled respiration with various substrates. Mitochondria isolated from patient lymphoblasts harboring 95-100% of mtDNAs carrying the nt 8993 T-->G mutation showed state III respiration rates 26-50% lower than controls while having normal DNP-uncoupled rates. This resulted in state III/DNP ratios of 0.52-0.70 in patient mitochondria versus 0.88-0.97 in controls. The ADP/O ratio was also decreased 30-40% in patient mitochondria. Patient lymphoblasts heteroplasmic for the nt 8993 mutation were enucleated by using Percoll gradients and the cytoplasts were fused to mtDNA-deficient (rho 0) cells by electric shock. Cybrid clones homoplasmic for the wild-type nucleotide (T) at nt 8993 gave state III/DNP and ADP/O ratios similar to those of control cybrids, whereas cybrid clones homoplasmic for the mutant nucleotide (G) showed a 24-53% reduction in state III respiration, a state III/DNP ratio of 0.53-0.64, and a 30% decrease in the ADP/O ratio. Thus, the reduced state III respiration rates and ADP/O ratios are linked to the T-->G mutation at nt 8993.",PS3_supporting,NC_012920.1:m.8993T>G,Cybrid studies supported the functional impact of this variant,,1,"Gene: , chr_pos_ref_alt (hg38): chrM_8993_T_G, chr_pos_ref_alt (hg37): chrM_8994_T_G, HGVSg (hg38): g.N/A, HGVSg (hg37): g.N/A, rsID: N/A, HGVSc: N/A, HGVSp (3-letter): N/A, HGVSp (1-letter): N/A"
19875463,"Mutations in the mitochondrial DNA (mtDNA) encoded subunit 6 of ATPase (ATP6) are associated with variable disease expression, ranging from adult onset neuropathy, ataxia and retinitis pigmentosa (NARP) to fatal childhood maternally inherited Leigh's syndrome (MILS). Phenotypical variations have largely been attributed to mtDNA heteroplasmy. However, there is often a discrepancy between the levels of mutant mtDNA and disease severity. Therefore, the correlation among genetic defect, bioenergetic impairment and clinical outcome in NARP/MILS remains to be elucidated. We investigated the bioenergetics of cybrids from five patients carrying different ATP6 mutations: three harboring the T8993G, one with the T8993C and one with the T9176G mutation. The bioenergetic defects varied dramatically, not only among different ATP6 mutants, but also among lines carrying the same T8993G mutation. Mutants with the most severe ATP synthesis impairment showed defective respiration and disassembly of respiratory chain complexes. This indicates that respiratory chain defects modulate the bioenergetic impairment in NARP/MILS cells. Sequencing of the entire mtDNA from the different mutant cell lines identified variations in structural genes, resulting in amino acid changes that destabilize the respiratory chain. Taken together, these results indicate that the mtDNA background plays an important role in modulating the biochemical defects and clinical outcome in NARP/MILS.",PS3_supporting,NC_012920.1:m.8993T>G,Cybrid studies supported the functional impact of this variant,,1,"Gene: , chr_pos_ref_alt (hg38): chrM_8993_T_G, chr_pos_ref_alt (hg37): chrM_8994_T_G, HGVSg (hg38): g.N/A, HGVSg (hg37): g.N/A, rsID: N/A, HGVSc: N/A, HGVSp (3-letter): N/A, HGVSp (1-letter): N/A"
18813315,"Recently, a rare activating mutation of AKT1 (E17K) has been reported in breast, ovarian, and colorectal cancers. However, analogous activating mutations in AKT2 or AKT3 have not been identified in any cancer lineage. To determine the prevalence of AKT E17K mutations in melanoma, the most aggressive form of skin cancer, we analysed 137 human melanoma specimens and 65 human melanoma cell lines for the previously described activating mutation of AKT1, and for analogous mutations in AKT2 and AKT3. We identified a single AKT1 E17K mutation. Remarkably, a previously unidentified AKT3 E17K mutation was detected in two melanomas (from one patient) as well as two cell lines. The AKT3 E17K mutation results in activation of AKT when expressed in human melanoma cells. This represents the first report of AKT mutations in melanoma, and the initial identification of an AKT3 mutation in any human cancer lineage. We have also identified the first known human cell lines with naturally occurring AKT E17K mutations.",PS3_supporting,NM_005465.7:c.49G>A,This variant has been shown to significantly increase phosphorylation levels in experiments with case and control cells of similar isogenic backgrounds indicating that this variant impacts protein function.,,1,"Gene: AKT3, chr_pos_ref_alt (hg38): chr1_243695714_C_T, chr_pos_ref_alt (hg37): chr1_243859016_C_T, HGVSg (hg38): g.243695714C>T, HGVSg (hg37): g.243859016C>T, rsID: rs397514606, HGVSc: c.49G>A, HGVSp (3-letter): p.Glu17Lys, HGVSp (1-letter): p.E17K"
29985963,"Lymphatic malformations (LM) are characterized by the overgrowth of lymphatic vessels during pre- and postnatal development. Macrocystic, microcystic and combined forms of LM are known. The cysts are lined by lymphatic endothelial cells (LECs). Resection and sclerotherapy are the most common treatment methods. Recent studies performed on LM specimens in the United States of America have identified activating mutations in the phosphatidylinositol-4,5-bisphosphate 3-kinase catalytic subunit alpha (PIK3CA) gene in LM. However, whole tissue but not isolated cell types were studied. Here, we studied LM tissues resected at the University Hospitals Freiburg and Regensburg, Germany. We isolated LECs and fibroblasts separately, and sequenced the commonly affected exons 8, 10, and 21 of the PIK3CA gene. We confirm typical monoallelic mutations in 4 out of 6 LM-derived LEC lines, and describe two new mutations i.) in exon 10 (c.1636C>A; p.Gln546Lys), and ii.) a 3bp in-frame deletion of GAA (Glu109del). LM-derived fibroblasts did not possess such mutations, showing cell-type specificity of the gene defect. High activity of the PIK3CA-AKT- mTOR pathway was demonstrated by hyperphosphorylation of AKT-Ser473 in all LM-derived LECs (including the ones with newly identified mutations), as compared to normal LECs. Additionally, hyperphosphorylation of ERK was seen in all LM-derived LECs, except for the one with Glu109del. In vitro, the small molecule kinase inhibitors Buparlisib/BKM-120, Wortmannin, and Ly294002, (all inhibitors of PIK3CA), CAL-101 (inhibitor of PIK3CD), MK-2206 (AKT inhibitor), Sorafenib (multiple kinases inhibitor), and rapamycin (mTOR inhibitor) significantly blocked proliferation of LM-derived LECs in a concentration-dependent manner, but also blocked proliferation of normal LECs. However, MK-2206 appeared to be more specific for mutated LECs, except in case of Glu109 deletion. In sum, children that are, or will be, treated with kinase inhibitors must be monitored closely.",PS3_moderate,NM_006218.4:c.325GAA[1],This variant was identified in a patient with a lymphatic malformation where phosphorylation was increased significantly above controls using patient derived cell lines,,1,"Gene: PIK3CA, chr_pos_ref_alt (hg38): chr3_179199149_TGAA_T, chr_pos_ref_alt (hg37): chr3_178916937_TGAA_T, HGVSg (hg38): g.179199150_179199155GAA[2], HGVSg (hg37): g.178916938_178916943GAA[2], rsID: rs1724343994, HGVSc: c.325_330GAA[1], HGVSp (3-letter): N/A, HGVSp (1-letter): N/A"
27159400,"IMPORTANCE: Focal cortical dysplasia (FCD), hemimegalencephaly, and megalencephaly constitute a spectrum of malformations of cortical development with shared neuropathologic features. These disorders are associated with significant childhood morbidity and mortality.
OBJECTIVE: To identify the underlying molecular cause of FCD, hemimegalencephaly, and diffuse megalencephaly.
DESIGN, SETTING, AND PARTICIPANTS: Patients with FCD, hemimegalencephaly, or megalencephaly (mean age, 11.7 years; range, 2-32 years) were recruited from Pediatric Hospital A. Meyer, the University of Hong Kong, and Seattle Children's Research Institute from June 2012 to June 2014. Whole-exome sequencing (WES) was performed on 8 children with FCD or hemimegalencephaly using standard-depth (50-60X) sequencing in peripheral samples (blood, saliva, or skin) from the affected child and their parents and deep (150-180X) sequencing in affected brain tissue. Targeted sequencing and WES were used to screen 93 children with molecularly unexplained diffuse or focal brain overgrowth. Histopathologic and functional assays of phosphatidylinositol 3-kinase-AKT (serine/threonine kinase)-mammalian target of rapamycin (mTOR) pathway activity in resected brain tissue and cultured neurons were performed to validate mutations.
MAIN OUTCOMES AND MEASURES: Whole-exome sequencing and targeted sequencing identified variants associated with this spectrum of developmental brain disorders.
RESULTS: Low-level mosaic mutations of MTOR were identified in brain tissue in 4 children with FCD type 2a with alternative allele fractions ranging from 0.012 to 0.086. Intermediate-level mosaic mutation of MTOR (p.Thr1977Ile) was also identified in 3 unrelated children with diffuse megalencephaly and pigmentary mosaicism in skin. Finally, a constitutional de novo mutation of MTOR (p.Glu1799Lys) was identified in 3 unrelated children with diffuse megalencephaly and intellectual disability. Molecular and functional analysis in 2 children with FCD2a from whom multiple affected brain tissue samples were available revealed a mutation gradient with an epicenter in the most epileptogenic area. When expressed in cultured neurons, all MTOR mutations identified here drive constitutive activation of mTOR complex 1 and enlarged neuronal size.
CONCLUSIONS AND RELEVANCE: In this study, mutations of MTOR were associated with a spectrum of brain overgrowth phenotypes extending from FCD type 2a to diffuse megalencephaly, distinguished by different mutations and levels of mosaicism. These mutations may be sufficient to cause cellular hypertrophy in cultured neurons and may provide a demonstration of the pattern of mosaicism in brain and substantiate the link between mosaic mutations of MTOR and pigmentary mosaicism in skin.",PS3_supporting,NM_004958.4:c.4379T>C,This variant has been shown to significantly increase phosphorylation levels in experiments with case and controls cells of similar isogenic backgrounds indicating that this variant impacts protein function (PMID: 27159400).,,1,"Gene: MTOR, chr_pos_ref_alt (hg38): chr1_11157242_A_G, chr_pos_ref_alt (hg37): chr1_11217299_A_G, HGVSg (hg38): g.11157242A>G, HGVSg (hg37): g.11217299A>G, rsID: rs1057519779, HGVSc: c.4379T>C, HGVSp (3-letter): p.Leu1460Pro, HGVSp (1-letter): p.L1460P"
25799227,"Focal cortical dysplasia type II (FCDII) is a sporadic developmental malformation of the cerebral cortex characterized by dysmorphic neurons, dyslamination and medically refractory epilepsy. It has been hypothesized that FCD is caused by somatic mutations in affected regions. Here, we used deep whole-exome sequencing (read depth, 412-668×) validated by site-specific amplicon sequencing (100-347,499×) in paired brain-blood DNA from four subjects with FCDII and uncovered a de novo brain somatic mutation, mechanistic target of rapamycin (MTOR) c.7280T>C (p.Leu2427Pro) in two subjects. Deep sequencing of the MTOR gene in an additional 73 subjects with FCDII using hybrid capture and PCR amplicon sequencing identified eight different somatic missense mutations found in multiple brain tissue samples of ten subjects. The identified mutations accounted for 15.6% of all subjects with FCDII studied (12 of 77). The identified mutations induced the hyperactivation of mTOR kinase. Focal cortical expression of mutant MTOR by in utero electroporation in mice was sufficient to disrupt neuronal migration and cause spontaneous seizures and cytomegalic neurons. Inhibition of mTOR with rapamycin suppressed cytomegalic neurons and epileptic seizures. This study provides, to our knowledge, the first evidence that brain somatic activating mutations in MTOR cause FCD and identifies mTOR as a treatment target for intractable epilepsy in FCD.",PS3_supporting,NM_004958.3:c.4447T>C,This variant has been shown to significantly increase phosphorylation levels in experiments with case and control cells of similar isogenic backgrounds indicating that this variant impacts protein function.,,1,"Gene: MTOR, chr_pos_ref_alt (hg38): chr1_11157174_A_G, chr_pos_ref_alt (hg37): chr1_11217231_A_G, HGVSg (hg38): g.11157174A>G, HGVSg (hg37): g.11217231A>G, rsID: rs1057519914, HGVSc: c.4447T>C, HGVSp (3-letter): p.Cys1483Arg, HGVSp (1-letter): p.C1483R"
24631838,"Genes encoding components of the PI3K-AKT-mTOR signaling axis are frequently mutated in cancer, but few mutations have been characterized in MTOR, the gene encoding the mTOR kinase. Using publicly available tumor genome sequencing data, we generated a comprehensive catalog of mTOR pathway mutations in cancer, identifying 33 MTOR mutations that confer pathway hyperactivation. The mutations cluster in six distinct regions in the C-terminal half of mTOR and occur in multiple cancer types, with one cluster particularly prominent in kidney cancer. The activating mutations do not affect mTOR complex assembly, but a subset reduces binding to the mTOR inhibitor DEPTOR. mTOR complex 1 (mTORC1) signaling in cells expressing various activating mutations remains sensitive to pharmacologic mTOR inhibition, but is partially resistant to nutrient deprivation. Finally, cancer cell lines with hyperactivating MTOR mutations display heightened sensitivity to rapamycin both in culture and in vivo xenografts, suggesting that such mutations confer mTOR pathway dependency.",PS3_supporting,NM_004958.3:c.4447T>C,This variant has been shown to significantly increase phosphorylation levels in experiments with case and control cells of similar isogenic backgrounds indicating that this variant impacts protein function.,,1,"Gene: MTOR, chr_pos_ref_alt (hg38): chr1_11157174_A_G, chr_pos_ref_alt (hg37): chr1_11217231_A_G, HGVSg (hg38): g.11157174A>G, HGVSg (hg37): g.11217231A>G, rsID: rs1057519914, HGVSc: c.4447T>C, HGVSp (3-letter): p.Cys1483Arg, HGVSp (1-letter): p.C1483R"
