pmid,abstract,evidence,#Variation,PS3_comments,BS3_comments,functional_experiment,variant_info
9634518,"Phenylketonuria (PKU) and mild hyperphenylalaninemia (MHP) are allelic disorders caused by mutations in the gene encoding phenylalanine hydroxylase (PAH). Previous studies have suggested that the highly variable metabolic phenotypes of PAH deficiency correlate with PAH genotypes. We identified both causative mutations in 686 patients from seven European centers. On the basis of the phenotypic characteristics of 297 functionally hemizygous patients, 105 of the mutations were assigned to one of four arbitrary phenotype categories. We proposed and tested a simple model for correlation between genotype and phenotypic outcome. The observed phenotype matched the predicted phenotype in 79% of the cases, and in only 5 of 184 patients was the observed phenotype more than one category away from that expected. Among the seven contributing centers, the proportion of patients for whom the observed phenotype did not match the predicted phenotype was 4%-23% (P<.0001), suggesting that differences in methods used for mutation detection or phenotype classification may account for a considerable proportion of genotype-phenotype inconsistencies. Our data indicate that the PAH-mutation genotype is the main determinant of metabolic phenotype in most patients with PAH deficiency. In the present study, the classification of 105 PAH mutations may allow the prediction of the biochemical phenotype in >10,000 genotypes, which may be useful for the management of hyperphenylalaninemia in newborns.",PS3,NM_000277.2:c.472C>T,2% mutant enzyme activity in BioPKU,,1,"Gene: PAH, chr_pos_ref_alt (hg38): chr12_102866633_G_A, chr_pos_ref_alt (hg37): chr12_103260411_G_A, HGVSg (hg38): g.102866633G>A, HGVSg (hg37): g.103260411G>A, rsID: rs75166491, HGVSc: c.472C>T, HGVSp (3-letter): p.Arg158Trp, HGVSp (1-letter): p.R158W"
3615198,"Classical Phenylketonuria (PKU) is an autosomal recessive human genetic disorder caused by a deficiency of hepatic phenylalanine hydroxylase (PAH). We isolated several mutant PAH cDNA clones from a PKU carrier individual and showed that they contained an internal 116 base pair deletion, corresponding precisely to exon 12 of the human chromosomal PAH gene. The deletion causes the synthesis of a truncated protein lacking the C-terminal 52 amino acids. Gene transfer and expression studies using the mutant PAH cDNA indicated that the deletion abolishes PAH activity in the cell as a result of protein instability. To determine the molecular basis of the deletion, the mutant chromosomal PAH gene was isolated from this individual and shown to contain a GT-- greater than AT substitution at the 5' splice donor site of intron 12. Thus, the consequence of the splice donor site mutation in the human liver is the skipping of the preceding exon during RNA splicing.",PS3,NM_000277.2:c.1315+1G>A,abolishes PAH activity due to protein instability,,1,"Gene: PAH, chr_pos_ref_alt (hg38): chr12_102840399_C_T, chr_pos_ref_alt (hg37): chr12_103234177_C_T, HGVSg (hg38): g.102840399C>T, HGVSg (hg37): g.103234177C>T, rsID: rs5030861, HGVSc: c.1315+1G>A, HGVSp (3-letter): N/A, HGVSp (1-letter): N/A"
15319459,"Tetrahydrobiopterin (BH4)-responsive phenylalanine hydroxylase (PAH) deficiency is characterized by reduction of blood phenylalanine level after a BH4-loading test. Most cases of BH4-responsive PAH deficiency include mild phenylketonuria (PKU) or mild hyperphenylalaninemia (HPA), but not all patients with mild PKU respond to BH4. We performed the phenylalanine breath test as reliable method to determine the BH4 responsiveness. Phenylalanine breath test quantitatively measures the conversion of L-[1-13C] phenylalanine to 13CO2 and is a noninvasive and rapid test. Twenty Japanese patients with HPA were examined with a dose of 10 mg/kg of 13C-phenylalanine with or without a dose of 10 mg . kg(-1) . d(-1) of BH4 for 3 d. The phenylalanine breath test [cumulative recovery rate (CRR)] could distinguish control subjects (15.4 +/- 1.5%); heterozygotes (10.3 +/- 1.0%); and mild HPA (2.74%), mild PKU (1.13 +/- 0.14%), and classical PKU patients (0.29 +/- 0.14%). The genotypes in mild PKU cases were compound heterozygotes with mild (L52S, R241C, R408Q) and severe mutations, whereas a mild HPA case was homozygote of R241C. CRR correlated inversely with pretreatment phenylalanine levels, indicating the gene dosage effects on PKU. BH4 loading increased CRR from 1.13 +/- 0.14 to 2.95 +/- 1.14% (2.6-fold) in mild PKU and from 2.74 to 7.22% (2.6-fold) in mild HPA. A CRR of 5 to 6% reflected maintenance of appropriate serum phenylalanine level. The phenylalanine breath test is useful for the diagnosis of BH4-responsive PAH deficiency and determination of the optimal dosage of BH4 without increasing blood phenylalanine level.",PS3,NM_000277.1:c.721C>T,In vitro PAH R241C mutant was found to have 25% PAH activity of normal. In vivo phenylalanine breath test measured a decreased level in R241C homozygote.,,1,"Gene: PAH, chr_pos_ref_alt (hg38): chr12_102852936_G_A, chr_pos_ref_alt (hg37): chr12_103246714_G_A, HGVSg (hg38): g.102852936G>A, HGVSg (hg37): g.103246714G>A, rsID: rs76687508, HGVSc: c.721C>T, HGVSp (3-letter): p.Arg241Cys, HGVSp (1-letter): p.R241C"
24401910,"Phenylalanine hydroxylase (PAH) deficiency is responsible for most cases of phenylketonuria (PKU). In this study of the PAH mutation spectrum in the Taiwanese population, 139 alleles were identified including 34 different mutations. The V190G, Q267R and F392I mutations are first reported in this study. The most common mutations, R241C, R408Q and Ex6-96A>G, account for 23.2%, 12.0% and 9.2%, of the mutant alleles, respectively. Haplotype analysis shows that R241C and Ex6-96A>G are exclusively associated with haplotype 4.3 to suggest founder effects. On the other hand, R408Q is found on two distinct haplotypes suggesting recurrent mutations. The spectrum of PAH mutations in Taiwan shows various links to those of other Asian regions, yet remarkable differences exist. Notably, R408Q, E286K and -4173_-407del, accounting for 21% of all mutant alleles in Taiwan, are very rare or are undetected among PKU cohorts of other Asian regions to suggest local founder effects. Moreover, the low homozygosity value of 0.092 hints at a high degree of ethnic heterogeneity within the Taiwanese population. Our study of PAH mutation spectrum and the associated haplotypes is useful for subsequent study on the origin and migration pattern via Taiwan, an island at the historical crossroad of migration of ancient populations.",PS3,NM_000277.1:c.755G>A,BioPKU 3% enzyme activity; 3.8% residual activity,,1,"Gene: PAH, chr_pos_ref_alt (hg38): chr12_102852902_C_T, chr_pos_ref_alt (hg37): chr12_103246680_C_T, HGVSg (hg38): g.102852902C>T, HGVSg (hg37): g.103246680C>T, rsID: rs62644503, HGVSc: c.755G>A, HGVSp (3-letter): p.Arg252Gln, HGVSp (1-letter): p.R252Q"
29706350,"Phosphatase and tensin homolog (PTEN) is a tumor suppressor frequently mutated in diverse cancers. Germline PTEN mutations are also associated with a range of clinical outcomes, including PTEN hamartoma tumor syndrome (PHTS) and autism spectrum disorder (ASD). To empower new insights into PTEN function and clinically relevant genotype-phenotype relationships, we systematically evaluated the effect of PTEN mutations on lipid phosphatase activity in vivo. Using a massively parallel approach that leverages an artificial humanized yeast model, we derived high-confidence estimates of functional impact for 7,244 single amino acid PTEN variants (86% of possible). We identified 2,273 mutations with reduced cellular lipid phosphatase activity, which includes 1,789 missense mutations. These data recapitulated known functional findings but also uncovered new insights into PTEN protein structure, biochemistry, and mutation tolerance. Several residues in the catalytic pocket showed surprising mutational tolerance. We identified that the solvent exposure of wild-type residues is a critical determinant of mutational tolerance. Further, we created a comprehensive functional map by leveraging correlations between amino acid substitutions to impute functional scores for all variants, including those not present in the assay. Variant functional scores can reliably discriminate likely pathogenic from benign alleles. Further, 32% of ClinVar unclassified missense variants are phosphatase deficient in our assay, supporting their reclassification. ASD-associated mutations generally had less severe fitness scores relative to PHTS-associated mutations (p = 7.16 × 10-5) and a higher fraction of hypomorphic mutations, arguing for continued genotype-phenotype studies in larger clinical datasets that can further leverage these rich functional data.",BS3_supporting,NM_000314.6:c.1052_1054delTAG,,In vitro or in vivo functional study or studies showing no damaging effect on protein function but BS3 not met.,1,"Gene: PTEN, chr_pos_ref_alt (hg38): chr10_87965309_CAGT_C, chr_pos_ref_alt (hg37): chr10_89725066_CAGT_C, HGVSg (hg38): g.87965312_87965314del, HGVSg (hg37): g.89725069_89725071del, rsID: rs587780003, HGVSc: c.1052_1054del, HGVSp (3-letter): N/A, HGVSp (1-letter): N/A"
30993208,"Anti-PTEN monoclonal antibodies (mAb) are arising as important tools for immunohistochemistry (IHC) and protein quantification routine analysis in clinical oncology. Although an effort has been made to document the reliability of tumor tissue section immunostaining by anti-PTEN mAb, and to standardize their IHC use in research and in the clinical practice, the precise topological and biochemical definition of the epitope recognized by each mAb has been conventionally overlooked. In this study, six commercial anti-PTEN mAb have been validated and characterized for sensitivity and specificity by IHC and FISH, using a set of prostate and urothelial bladder tumor specimens, and by immunoblot, using PTEN positive and PTEN negative human cell lines. Immunoblot precise epitope mapping, performed using recombinant PTEN variants and mutations, revealed that all mAb recognized linear epitopes of 6-11 amino acid length at the PTEN C-terminus. Tumor-associated or disease-associated mutations at the PTEN C-terminus did not affect subcellular localization or PIP3 phosphatase activity of PTEN in cells, although resulted in specific loss of reactivity for some mAb. Furthermore, specific mimicking-phosphorylation mutations at the PTEN C-terminal region also abolished binding of specific mAb. Our study adds new evidence on the relevance of a precise epitope mapping in the validation of anti-PTEN mAb for their use in the clinics. This will be substantial to provide a more accurate diagnosis in clinical oncology based on PTEN protein expression in tumors and biological fluids.",BS3,NM_000314.6:c.1171C>T,,Missense variants with both lipid phosphatase activity AND results from a second assay appropriate to the protein domain demonstrating no statistically significant difference from wild type.,1,"Gene: PTEN, chr_pos_ref_alt (hg38): chr10_87965431_C_T, chr_pos_ref_alt (hg37): chr10_89725188_C_T, HGVSg (hg38): g.87965431C>T, HGVSg (hg37): g.89725188C>T, rsID: rs786203911, HGVSc: c.1171C>T, HGVSp (3-letter): p.Pro391Ser, HGVSp (1-letter): p.P391S"
29785012,"Determining the pathogenicity of genetic variants is a critical challenge, and functional assessment is often the only option. Experimentally characterizing millions of possible missense variants in thousands of clinically important genes requires generalizable, scalable assays. We describe variant abundance by massively parallel sequencing (VAMP-seq), which measures the effects of thousands of missense variants of a protein on intracellular abundance simultaneously. We apply VAMP-seq to quantify the abundance of 7,801 single-amino-acid variants of PTEN and TPMT, proteins in which functional variants are clinically actionable. We identify 1,138 PTEN and 777 TPMT variants that result in low protein abundance, and may be pathogenic or alter drug metabolism, respectively. We observe selection for low-abundance PTEN variants in cancer, and show that p.Pro38Ser, which accounts for ~10% of PTEN missense variants in melanoma, functions via a dominant-negative mechanism. Finally, we demonstrate that VAMP-seq is applicable to other genes, highlighting its generalizability.",BS3,NM_000314.6:c.1171C>T,,Missense variants with both lipid phosphatase activity AND results from a second assay appropriate to the protein domain demonstrating no statistically significant difference from wild type.,1,"Gene: PTEN, chr_pos_ref_alt (hg38): chr10_87965431_C_T, chr_pos_ref_alt (hg37): chr10_89725188_C_T, HGVSg (hg38): g.87965431C>T, HGVSg (hg37): g.89725188C>T, rsID: rs786203911, HGVSc: c.1171C>T, HGVSp (3-letter): p.Pro391Ser, HGVSp (1-letter): p.P391S"
28677221,"Germline mutations in the tumor-suppressor gene PTEN predispose to subsets of Cowden syndrome (CS), Bannayan-Riley-Ruvalcaba syndrome, and autism. Evidence-based classification of PTEN variants as either deleterious or benign is urgently needed for accurate molecular diagnosis and gene-informed genetic counseling. We studied 34 different germline PTEN intronic variants from 61 CS patients, characterized their PTEN mRNA processing, and analyzed PTEN expression and downstream readouts of P-AKT and P-ERK1/2. While we found that many mutations near splice junctions result in exon skipping, we also identified the presence of cryptic splicing that resulted in premature termination or a shift in isoform usage. PTEN protein expression is significantly lower in the group with splicing changes while P-AKT, but not P-ERK1/2, is significantly increased. Our observations of these PTEN intronic variants should contribute to the determination of pathogenicity of PTEN intronic variants and aid in genetic counseling.",PS3,NM_000314.6:c.209+4_209+7delAGTA,"RNA, mini-gene, or other assay shows impact on splicing.",,1,"Gene: PTEN, chr_pos_ref_alt (hg38): chr10_87925557_TGTAA_T, chr_pos_ref_alt (hg37): chr10_89685314_TGTAA_T, HGVSg (hg38): g.87925561_87925564del, HGVSg (hg37): g.89685318_89685321del, rsID: rs398123318, HGVSc: c.209+4_209+7del, HGVSp (3-letter): N/A, HGVSp (1-letter): N/A"
32350270,"Functional variomics provides the foundation for personalized medicine by linking genetic variation to disease expression, outcome and treatment, yet its utility is dependent on appropriate assays to evaluate mutation impact on protein function. To fully assess the effects of 106 missense and nonsense variants of PTEN associated with autism spectrum disorder, somatic cancer and PTEN hamartoma syndrome (PHTS), we take a deep phenotypic profiling approach using 18 assays in 5 model systems spanning diverse cellular environments ranging from molecular function to neuronal morphogenesis and behavior. Variants inducing instability occur across the protein, resulting in partial-to-complete loss-of-function (LoF), which is well correlated across models. However, assays are selectively sensitive to variants located in substrate binding and catalytic domains, which exhibit complete LoF or dominant negativity independent of effects on stability. Our results indicate that full characterization of variant impact requires assays sensitive to instability and a range of protein functions.",PS3_supporting,NM_000314.6:c.103A>G,Abnormal in vitro cellular assay or transgenic model with phenotype different from wild type that does not meet PS3 (Post et al. 2020 PMID: 32350270: pAKT levels similar to C124S).,,1,"Gene: PTEN, chr_pos_ref_alt (hg38): chr10_87894048_A_G, chr_pos_ref_alt (hg37): chr10_89653805_A_G, HGVSg (hg38): g.87894048A>G, HGVSg (hg37): g.89653805A>G, rsID: rs876659443, HGVSc: c.103A>G, HGVSp (3-letter): p.Met35Val, HGVSp (1-letter): p.M35V"
9256433,"Protein tyrosine phosphatases (PTPs) have long been thought to play a role in tumor suppression due to their ability to antagonize the growth promoting protein tyrosine kinases. Recently, a candidate tumor suppressor from 10q23, termed P-TEN, was isolated, and sequence homology was demonstrated with members of the PTP family, as well as the cytoskeletal protein tensin. Here we show that recombinant P-TEN dephosphorylated protein and peptide substrates phosphorylated on serine, threonine, and tyrosine residues, indicating that P-TEN is a dual-specificity phosphatase. In addition, P-TEN exhibited a high degree of substrate specificity, showing selectivity for extremely acidic substrates in vitro. Furthermore, we demonstrate that mutations in P-TEN, identified from primary tumors, tumor cells lines, and a patient with Bannayan-Zonana syndrome, resulted in the ablation of phosphatase activity, demonstrating that enzymatic activity of P-TEN is necessary for its ability to function as a tumor suppressor.",PS3,NM_000314.6:c.510T>A,Phosphatase activity <50% of wild type,,1,"Gene: PTEN, chr_pos_ref_alt (hg38): chr10_87952135_T_A, chr_pos_ref_alt (hg37): chr10_89711892_T_A, HGVSg (hg38): g.87952135T>A, HGVSg (hg37): g.89711892T>A, rsID: rs121909221, HGVSc: c.510T>A, HGVSp (3-letter): p.Ser170Arg, HGVSp (1-letter): p.S170R"
25230692,"Mutations in COCH (coagulation factor C homology) cause autosomal-dominant nonsyndromic hearing loss with variable degrees of clinical onset and vestibular malfunction. We selected eight uncharacterized mutations and performed immunocytochemical and Western blot analyses to track cochlin through the secretory pathway. We then performed a comprehensive analysis of clinical information from DFNA9 patients with all 21 known COCH mutations in conjunction with cellular and molecular findings to identify genotype-phenotype correlations. Our studies revealed that five mutants were not secreted into the media: two von Willebrand factor A (vWFA) domain mutants, which were not transported from the endoplasmic reticulum to Golgi complex and formed high-molecular-weight aggregates in cell lysates, and three LCCL domain mutants, which were detected as intracellular dimeric cochlins. Mutant cochlins that were not secreted and accumulated in cells result in earlier age of onset of hearing defects. In addition, individuals with LCCL domain mutations show accompanying vestibular dysfunction, whereas those with vWFA domain mutations exhibit predominantly hearing loss. This is the first report showing failure of mutant cochlin transport through the secretory pathway, abolishment of cochlin secretion, and formation and retention of dimers and large multimeric intracellular aggregates, and high correlation with earlier onset and progression of hearing loss in individuals with these DFNA9-causing mutations.",BS3_supporting,NM_004086.2:c.355G>A,,Functional studies show no differences between wild-type and p.A119T variant cochlin localization and secretion,1,"Gene: COCH, chr_pos_ref_alt (hg38): chr14_30878926_G_A, chr_pos_ref_alt (hg37): chr14_31348132_G_A, HGVSg (hg38): g.30878926G>A, HGVSg (hg37): g.31348132G>A, rsID: rs121908931, HGVSc: c.355G>A, HGVSp (3-letter): p.Ala119Thr, HGVSp (1-letter): p.A119T"
24829265,"RATIONALE: Approximately 40% of hypertrophic cardiomyopathy (HCM) is caused by heterozygous missense mutations in β-cardiac myosin heavy chain (β-MHC). Associating disease phenotype with mutation is confounded by extensive background genetic and lifestyle/environmental differences between subjects even from the same family.
OBJECTIVE: To characterize disease caused by β-cardiac myosin heavy chain Val606Met substitution (VM) that has been identified in several HCM families with wide variation of clinical outcomes, in mice.
METHODS AND RESULTS: Unlike 2 mouse lines bearing the malignant myosin mutations Arg453Cys (RC/+) or Arg719Trp (RW/+), VM/+ mice with an identical inbred genetic background lacked hallmarks of HCM such as left ventricular hypertrophy, disarray of myofibers, and interstitial fibrosis. Even homozygous VM/VM mice were indistinguishable from wild-type animals, whereas RC/RC- and RW/RW-mutant mice died within 9 days after birth. However, hypertrophic effects of the VM mutation were observed both in mice treated with cyclosporine, a known stimulator of the HCM response, and compound VM/RC heterozygous mice, which developed a severe HCM phenotype. In contrast to all heterozygous mutants, both systolic and diastolic function of VM/RC hearts was severely impaired already before the onset of cardiac remodeling.
CONCLUSIONS: The VM mutation per se causes mild HCM-related phenotypes; however, in combination with other HCM activators it exacerbates the HCM phenotype. Double-mutant mice are suitable for assessing the severity of benign mutations.",PS3,NM_000257.3:c.2155C>T,A mouse model indicates that this variant disrupts the function of MYH7 and leads to a phenotype consistent with HCM,,1,"Gene: MYH7, chr_pos_ref_alt (hg38): chr14_23425971_G_A, chr_pos_ref_alt (hg37): chr14_23895180_G_A, HGVSg (hg38): g.23425971G>A, HGVSg (hg37): g.23895180G>A, rsID: rs121913637, HGVSc: c.2155C>T, HGVSp (3-letter): p.Arg719Trp, HGVSp (1-letter): p.R719W"
16983074,"Dilated cardiomyopathy (DCM) leads to heart failure, a leading cause of death in industrialized nations. Approximately 30% of DCM cases are genetic in origin, with some resulting from point mutations in cardiac myosin, the molecular motor of the heart. The effects of these mutations on myosin's molecular mechanics have not been determined. We have engineered two murine models characterizing the physiological, cellular, and molecular effects of DCM-causing missense mutations (S532P and F764L) in the alpha-cardiac myosin heavy chain and compared them with WT mice. Mutant mice developed morphological and functional characteristics of DCM consistent with the human phenotypes. Contractile function of isolated myocytes was depressed and preceded left ventricular dilation and reduced fractional shortening. In an in vitro motility assay, both mutant cardiac myosins exhibited a reduced ability to translocate actin (V(actin)) but had similar force-generating capacities. Actin-activated ATPase activities were also reduced. Single-molecule laser trap experiments revealed that the lower V(actin) in the S532P mutant was due to a reduced ability of the motor to generate a step displacement and an alteration of the kinetics of its chemomechanical cycle. These results suggest that the depressed molecular function in cardiac myosin may initiate the events that cause the heart to remodel and become pathologically dilated.",PS3,NM_000257.3:c.1594T>C,Mouse model indicates that this variant disrupts the function of MYH7 and leads to a phenotype consistent with DCM,,1,"Gene: MYH7, chr_pos_ref_alt (hg38): chr14_23427879_A_G, chr_pos_ref_alt (hg37): chr14_23897088_A_G, HGVSg (hg38): g.23427879A>G, HGVSg (hg37): g.23897088A>G, rsID: rs121913642, HGVSc: c.1594T>C, HGVSp (3-letter): p.Ser532Pro, HGVSp (1-letter): p.S532P"
23313350,"Dilated cardiomyopathy (DCM) is a disease characterized by dilation of the ventricular chambers and reduced contractile function. We examined the contractile performance of chemically-skinned ventricular strips from two heterozygous murine models of DCM-causing missense mutations of myosin, F764L/+ and S532P/+, in an α-myosin heavy chain (MyHC) background. In Ca(2+)-activated skinned myocardial strips, the maximum developed tension in F764L/+ was only ~50% that of litter-mate controls (+/+). The F764L/+ also exhibited significantly reduced rigor stiffness, loaded shortening velocity and power output. Corresponding indices for S532P/+ strips were not different from controls. Manipulation of MgATP concentration in conjunction with measures of viscoelasticity, which provides estimates of myosin detachment rate 2πc, allowed us to probe the molecular basis of changes in crossbridge kinetics that occur with the myosin mutations. By examining the response of detachment rate to varying MgATP we found the rate of MgADP release was unaffected by the myosin mutations. However, MgATP binding rate was higher in the DCM groups compared to controls (422±109mM(-1)·s(-1) in F764L/+, 483±74mM(-1)·s(-1) in S532P/+ and 303±18mM(-1)·s(-1) in +/+). In addition, the rate constant of force development, 2πb, was significantly higher in DCM groups compared to controls (at 5mM MgATP: 36.9±4.9s(-1) in F764L/+, 32.9±4.5s(-1) in S532P/+ and 18.2±1.7s(-1) in +/+). These results suggest that elevated rates of force development and MgATP binding are features of cardiac myofilament function that underlie the development of DCM.",PS3,NM_000257.3:c.1594T>C,Mouse model indicates that this variant disrupts the function of MYH7 and leads to a phenotype consistent with DCM,,1,"Gene: MYH7, chr_pos_ref_alt (hg38): chr14_23427879_A_G, chr_pos_ref_alt (hg37): chr14_23897088_A_G, HGVSg (hg38): g.23427879A>G, HGVSg (hg37): g.23897088A>G, rsID: rs121913642, HGVSc: c.1594T>C, HGVSp (3-letter): p.Ser532Pro, HGVSp (1-letter): p.S532P"
